Record#,Sentence,Tagging,Female,Male,Unknown,Disregarded
127,Jobs: Tegwins first job was as a bank clerk.,u,0,0,1,0
128,"However, when Connie falls for a lowly bank clerk she is forced to make a choice between her family and the man she loves.",m,0,1,0,0
129,"His mother was a bank clerk, and his father was a lathe worker.",f,1,0,0,0
130,Edward Chapman himself spent six years working as a bank clerk before eventually getting his own way and becoming an actor.,m,0,1,0,0
131,"In 1931, he gave up his job as a bank clerk to become a golf professional . Although successful in tournaments, Hogan realised that he needed to improve his technique to become truly competitive.",m,0,1,0,0
132,"The bank clerk was free to dress in black because her job did not involve coming into contact with customers, although like many professional Goths she reserved more extreme hair and make-up for club nights out.",f,1,0,0,0
133,"A one-time bank clerk, John gained his early experience of snooker in Potters Club in Salford, still a well known haunt of many professionals.",m,0,1,0,0
134,"Two external actors [Jacobson+94] interact with the system: a bank clerk (using a debit dialog box), and an external banking system (using an intermediate file format).",u,0,0,1,0
135,"""A little gem from Ealing Studios"" ""Alec Guinness at his peak"" ""Alec Guinness and Stanley Holloway make a great team"" ""this film is a joy to watch"" The Lavender Hill Mob Directed by Charles Crichton Starring Alec Guinness and Stanley Holloway Synopsis A timid bank clerk, schemes to get back at his employer, the Bank of England, by masterminding a foolproof heist.",m,0,1,0,0
136,"He and his wife also accommodated The District Bank in their cottage - open one afternoon a week, the bank clerk used to carry the money in a bag up from the station with complete safety.",u,0,0,1,0
137,Poet: Robert Browning Robert Browning was born in South London and his father was a bank clerk.,m,0,1,0,0
138,"John was engaged to Beryl age 22, a bank clerk, who lived at 222 St Thomas'' Road, Preston.",f,1,0,0,0
139,"By the time of Khronicles Joe has become a robotic, muscle ridden skinhead, whereas previously, he was a turtle-helmeted bank clerk with a gun.",m,0,1,0,0
140,"In the delightfully wicked Kind Hearts and Coronets , a serial killer politely murders his way into the peerage; in The Lavender Hill Mob a put-upon bank clerk schemes to rob his employers; The Man in the White Suit is a harshly satirical depiction of idealism crushed by the status quo; while The Ladykillers mocks both the criminals and the authorities with its unlikely octogenarian heroine Mrs ""lop-sided"" Wilberforce.",m,0,1,0,0
141,"Even the Right agreed that there should be generous welfare provision for, say, the mother-of-six widowed by her bank clerk husbandâ€TMs early death.",m,0,1,0,0
142,"At the time of the 1901 census, Lily Tawney at the age of 34 is back at home in St Giles'' Street . Her mother (72) is now a widow, and three of her siblings are still at home: Eleanor (44), Mabel (43) and John (32 and now a bank clerk).",m,0,1,0,0
143,His clerk was a Leading Writer and had been a bank clerk.,m,0,1,0,0
144,Sarah: a former bank clerk whose husband is a Business Management Consultant.,f,1,0,0,0
145,Donald Thomas left school at 16 and worked as a bank clerk before volunteering for the RAF at the age of 18.,m,0,1,0,0
146,"The story gos like this its a Thriller EG is a bank clerk and christopher plummer is a bank robber, he hands EG a note asking him to empty the cash till one day and when the alarms go off he escapes with some not all of the money. so CP then tracks down EG to get the rest of the money back.",u,0,0,1,0
