Record#,Sentence,Tagging,Female,Male,Unknown,Disregarded
135,Cadet weeks are organised during the summer for unaccompanied children over 10 to stay on board Egremont and learn to sail or get advanced tuition if they are already budding Olympic medallists!,u,0,0,1,0
136,"Road Policing, Community Safety and the police cadet programme.",u,0,0,1,0
137,(e) this Estimate also provides for the payment of injury benefits to adult instructors of the cadet forces. 2.,u,0,0,1,0
138,Abi is the only female cadet on the Junior Team.,f,1,0,0,0
139,After five years at the local gymnasium he entered military service as cadet in chevauxleger regiment number 6 on the 18th of March 1850.,m,0,1,0,0
140,"All these subjects are designed to give new cadets a good grounding in what is required from them as they progress through cadet life - get the simple things right first, and adverture training, flying, gliding and shooting will be a lot easier!",u,0,0,1,0
141,"Also in the mix is Captain Hyde''s son Philip (Simon Lack, who was in Nigel Kneale''s The Creature and much later faced another creature in Trog ), a cadet at the college, who breaks the news to his father that he wants to leave the Navy and go into business.",m,0,1,0,0
142,"Captain Rock, Captain Rapp and Captain Sky did their space cadet thang, but nobody could go further out into the phunkosphere than George Clinton.",d,0,0,0,1
143,"Take her: navigation officer, cadet school, Space Corps., well-spoken, can stay awake during operas, knows her cheeses.",f,1,0,0,0
144,"After being given a ''guard of honour'' welcome it is discovered he is just a new cadet reporting for training! also at the academy is the Wild radar(Van Heflin), a secret follower of John Brown (raymond Massey), the abolitionist who wants to change the social order in America.",u,0,0,1,0
145,The priorities drawn up against the age distribution of cadets is :- 13 to 15 year olds inclusive: 3 - 4 flights in 2 years Newly recruited older cadets : one flight as soon as ready then according to age priority 16 year old plus: 1 - 2 sorties over the remainder of cadet career.,u,0,0,1,0
146,As a young man John trained as a cadet and then became a fully qualified fire fighter in Surrey and London before serving as a qualified police officer in the Metropolitan Police.,m,0,1,0,0
147,Once qualified the cadet leader must always operate under a BCU Coach - Level 2 or higher.,u,0,0,1,0
148,I shall join the space cadet group. 2 I''m a bit of a hacker with a fair amount of previous programming experience.,d,0,0,0,1
149,Martin''s son Edward (10) is now karting in the cadet class and showing real promise as he moves up the ranks.,m,0,1,0,0
150,(Cadet) Posted to Slough (Windsor Road) 1958.,u,0,0,1,0
151,"But it did not stop the cadet squad winning five of their six sections to secure team gold, as well as individual silver and bronze medals.",u,0,0,1,0
152,This course is designed to train potential cadet SNCOs.,u,0,0,1,0
153,"The Isle had 3 divisions, Ely, March and Wisbech, one cadet being posted to each H.Q. I have never tried to confirm this belief.",u,0,0,1,0
154,"The 18 year old Manoel, in training as a naval cadet, succeeded to the throne as Manoel II.",m,0,1,0,0
155,"Disfigured by an exceptionally large and ugly nose, Cyrano is convinced that no woman could love such a face, but he is so in love with his cousin Roxanne that he will do anything to make her happy, even if it means convincing her through his own letters that a dumb but handsome cadet is everything she dreams of in a man.",m,0,1,0,0
156,Join our cadets today Join our cadet force and help make childhood cancers a thing of the past.,d,0,0,0,1
157,The cadet coordinator is responsible for a small annual budget and most cadet units raise money for themselves by way of various fundraising activities in order to pay for equipment and trips out.,u,0,0,1,0
158,"With this in mind, a volunteer cadet scheme was established in April 2006, aimed at helping young people become positive and active citizens.",u,0,0,1,0
159,John O''Hanlon came to Queens'' from Wycliffe College as an air crew cadet in the University Air Squadron on the six-month term war-time arrangement allowing 18 year-olds to continue their education whilst being trained as air crew.,m,0,1,0,0
160,"After the conclusion of the formal part of the evening, a short programme of musical items ensued which was sustained by Ella McConnell in Scots songs and Norman H MacDonald in Gaelic and Scots songs, including the well-loved Mhairead Og (Mull Fisher''s Love Song), arranged by Marjory Kennedy-Fraser but originally a composition of Donald Donn MacDonald of the Keppoch cadet family of Bohuntine.",u,0,0,1,0
161,"They were hoisted by a color guard provided by the ROTC battalion, to the tune of ""To the Colors"" rendered by a bugler from the band and supervised by the cadet battalion staff.",u,0,0,1,0
162,"In a speech to the Royal United Services Institute in February, the Chancellor announced plans for an expansion of the cadet forces, particularly in state schools in deprived areas.",u,0,0,1,0
163,Core Module Three: Developing Personal Effectiveness This module is usually undertaken when the cadet is 18 years of age.,u,0,0,1,0
164,"The water was a balmy 0.5 0 C with a bracing wind to add to the atmosphere when Jo the cadet, Johnny the computer and Alex the doc each dived into the penguin infested waters.",f,1,0,0,0
165,Ranked sixth on in every category police cadet route and with knock-outs.,u,0,0,1,0
166,"A fine exhibition was mounted in St James Park near Westminster, in the main manned by young enthusiastic cadet types ably supported by more mature personage and included a typical Forces variety show complete with a fine rendition by performers and audience of ""God Save the King"".",u,0,0,1,0
167,"To receive the provisional award they have had to pass the first class cadet examination, show that they have the knowledge of the theory of short range radios and that they are fully capable of operating the Squadron equipment under the supervision of the Squadron radio officer.",u,0,0,1,0
168,The Royal Engineers Museum holds a large collection of documents and artefacts spanning Gordon''s military carrer from him time as a cadet at RMA Woolwich to his death in Khartoum in 1885.,u,0,0,1,0
169,"Jack Swindells was fifth in the cadet section, while his Warrington AA Red team were fourth and Warrington AA Blue were fifth.",m,0,1,0,0
170,NFA cadet title for Worksop anglers Matthew Godfrey of Wales has proven beyond any shadow of a doubt that he is the best Cadet angler in the country.,m,0,1,0,0
171,"After attending the Gymnasium at Kremsmünster he became a cadet at the technical military academy in Vienna from which he was commissioned on the Kaiser''s birthday, 18th of August 1883 as a Leutnant with assignment to the 2.",m,0,1,0,0
172,"This funding will be used to support TA''s younger elements of the organisation, with emphasis on the expanding junior unit and the creation for 2007 of a cadet unit, as well as benefiting the current A guard.",u,0,0,1,0
173,"He had married Mary Ramsay, only daughter and heiress of Alexander Ramsay of Jamaica, a cadet of Balmain.",f,1,0,0,0
174,"Foreign Countries . Arms are not granted to non-British citizens (though those of Scottish ancestry can apply to the Lord Lyon King of Arms for cadet-matriculations, as above described) Moreover even if not of direct armigerous descent, foreigners of Scottish descent can often arrange for a cousin in Scotland, or in one of Her Majesty''s overseas realms get arms established by the Lord Lyon King of Arms, and thereafter themselves to obtain a cadet matriculation.",u,0,0,1,0
175,The nautical studies and engineering department of the North Atlantic Fisheries College has announced plans to run cadet training courses in the Northern Isles from September.,u,0,0,1,0
176,The photo was taken in 1989 when Richard was an air cadet visiting the team during their pre-season practice in Cyprus.,u,0,0,1,0
177,Ian Tillyard attended a six-week camp at Banff as a guest of the Canadian army cadet force. 21 members of the R.A.F. section attended R.A.F. Cosford and the following certificates were awarded.,m,0,1,0,0
178,Lincolnshire Police sponsor the cadet corps and fund the programme year on year to enable young people to ''get involved'' at no cost.,u,0,0,1,0
179,"Off we went to Catterick Barracks, where we had truly a day to remember, from bandaged volunteers for First Aid to the Army cadet who commented on Miss Jarvis being from London - she had to be a southerner because she spent so long stranded on the highest obstacle on the assault course!",u,0,0,1,0
180,After attending the Realschule and 4 years at the cavalry cadet institute he was posted as second of his age class to Landwehr Ulanen Regiment number 5 (in 1917 renamed as Reitendes Schützen Regiment Nr.5) in Stockerau near Vienna.,m,0,1,0,0
181,CADET ADDRESSES SCOTTISH PARLIMENT By Cadet Niall Morrison On December 12th 2001 I was proud to deliver the Scottish Parliament''s Time for Reflection at the Parliament in Edinburgh.,m,0,1,0,0
182,Upscale center in the martial arts a cadet at.,u,0,0,1,0
183,Hon. Junior Membership is available for a maximum of 3 years to those leaving school or the cadet forces.,u,0,0,1,0
184,"Final member of the team was the reserve – Will Law (P, Remove) who won the prize for best new cadet in the summer.",m,0,1,0,0
185,"A couple of centuries ago it became almost a routine boast to claim foreign ancestry for Scottish clans, to the extent that Skene protested: ""We have shown it to be invariably the case, that when a clan claims a foreign origin, and accounts for their possession of the chiefship and property of the clan by a marriage with the heiress of the old proprietors, they can be proved to be in reality a cadet of that older house who had usurped the chiefship, while their claim to the chiefship is disputed by an acknowledged descendant of that older house.",u,0,0,1,0
186,Cadet 100 To achieve this award the cadet must attend the annual tri - service shooting competition at Bisley and must achieve a score which places them among the top 100 cadets in the ATC.,u,0,0,1,0
187,"Music and art and drama, as described elsewhere in this newsletter, are strongly active, as is the cadet corps.",u,0,0,1,0
188,"The Queen''s speech was relayed at 9.00pm Return to top Silver Jubilee Celebrations, Saturday 11th June 1977 - Her Majesty Queen Elizabeth ll Heralded by a fanfare and bugles and a roll of drums from the St John Ambulance cadet band, the Brockham and Strood Green jubilee procession set off from the Avenue.",u,0,0,1,0
189,Transfer to the regular force is also based on satisfactory progress during the cadet programme.,u,0,0,1,0
190,"Daniel Cooper commenting, on his achievement, said,"" With over 300 cadets on parade after the athletics I was absolutely amazed when my name was called out as the best male sports cadet for the year.",m,0,1,0,0
191,One cadet completed a Gliding Scholarship and the Cadet Warrant Officer completed 200 hours for the Millennium Volunteers.,u,0,0,1,0
192,Precisely how cadet subscriptions are collected is a matter for each unit.,u,0,0,1,0
193,"I am an ex-army cadet (don''t laugh) - so I know a thing or two about camping, so let me know of any questions.",u,0,0,1,0
194,After leaving secondary school at Graz he attended the nearby infantry cadet school at Liebenau and on the 12th of November 1878 was assigned to Feldjäger Battalion number 27 at Cilli and was promoted to Kadett-Oberjäger on the 18th of August 1879.,m,0,1,0,0
195,"Corporal''s shako braid was worn by students with ""good progress"" at the cadet schools and Feldwebel''s braid by the Zöglinge at the cadet schools with two collar braids and all Zöglinge at the military academies.",u,0,0,1,0
196,"Biog.] 1834 JAMES CHARTERIS, a cadet of the family of C. of Amisfield ; licen. by Presb. of Dumfries 6th Sept. 1831; pres. by Francis, Earl of Wemyss and March, 6th Aug., called 16th Oct., and ord.",m,0,1,0,0
197,"The certificate will be paid for by Wing HQ when the cadet completes the Staff Part 1, and awarded to the individual.",u,0,0,1,0
198,The messing requirements for up to 20 staff and 10 cadet students began to become more complex.,u,0,0,1,0
199,Last year the present Warrant officer cadet Lawrence Clark was awarded the A.,m,0,1,0,0
200,He entered military education at the early age of 9 with the cadet company at Graz and was transferred to infantry regiment number 16 on the 1st of May 1835 as a cadet.,m,0,1,0,0
201,"1 April each year Table 2.9 Full-time trained strength and requirement, at 1 April each year Table 2.10 Strength of UK Regular Forces by ethnic origin, Service and rank, at 1 April 2005 Table 2.11 Strength of UK Regular Forces by ethnic origin and rank, at 1 April each year Table 2.12 Strength of UK Regular Forces by sex and rank Table 2.13 Strength of UK Regular Forces by sex and Service, at 1 April each year Table 2.14 Strength of the Reserve Forces, at 1 April each year Table 2.15 Strength of the cadet forces at 1 April each year Table 2.16 Intake to UK Regular Forces from civil life by service Table 2.17 Intake to untrained strength of UK Regular Forces by ethnic origin and Service Table 2.18 Intake to untrained strength of UK Regular Forces by sex and Service Table 2.19 Gains to trained strength of UK Regular Forces by Service Table 2.20 Outflow from UK Regular Forces by Service and whether trained or untrained Charts to Tables 2.16 & 2.20 Intake and Outlow of UK Regular Forces Table 2.21 Outflow from trained strength to civil life of UK Regular Forces by",u,0,0,1,0
202,This is why we introduced the cadet scheme.,u,0,0,1,0
203,"You also have to be wary of foreground clutter too such as heads, speaker poles, runway lights and the bain of every aviation photographer, the ATC cadet, watch out for ones with a photographer obscurer.",u,0,0,1,0
204,"The family is a cadet branch of the Nugents, Lords Delvin, afterwards Earls of Westmeath, and has been at Farren Connell since the end of the 17th century.",m,0,1,0,0
205,"The CCF receives assistance and support for its training programme from the Regular and Reserve Forces, but the bulk of adult support is provided by members of school staffs who are responsible to head teachers for the conduct of cadet activities.",u,0,0,1,0
206,Starting as a Russian cadet in training the game quickly turns for the worse as German troops attack and you are left scrambling for a gun to replace your stick and potato grenades.,u,0,0,1,0
207,I achieved Staff cadet and designed a squadron website to be proud of!,u,0,0,1,0
