Record#,Sentence,Tagging,Female,Male,Unknown,Disregarded
105,"However, in an interview published in the independent newsheet Mediafax on 13 November, Ngonhamo, who was head of Renamo military intelligence during the war of destabilisation, declared that, ""as a citizen and as a military officer"", he is in favour of conscription.",m,0,1,0,0
106,"Depending on what the officer says, that bar is sometimes lifted.",u,0,0,1,0
107,""" Fortunately for the Hebrew''s peace of mind, an officer accosted them at that moment, and, directing the one to head a band just ready to march, led the other to the force which was to be commanded by the chief in person.",u,0,0,1,0
108,"The inspecting officer should therefore on arrival at the premises request to see a company officer, the bankrupt or other person in charge, as appropriate.",d,0,0,0,1
109,"He married Audrey Elizabeth Moulton, and had one son and two daughters Interests: Rugby, tennis, agriculture Biography Taxing career The son of a naval chief petty officer who died when his son was just nine years old, James Callaghan left school at 14.",m,0,1,0,0
110,"""Police are appealing for information about a crime...please contact your local police officer or alternatively phone Crimestoppers on 0800 555 111.",u,0,0,1,0
111,Do this by telephoning 01427 676 676 and asking for the department or officer you require.,u,0,0,1,0
112,"Andreas Giovanni Newbery Police Constable Cambridgeshire Constabulary Died 5th February 2003, aged 34 The officer was at the rear of his marked police car on the hard shoulder of the A1 motorway near Alconbury, preparing to protect the scene of a vehicle collision, when a passing car spun out of control in the icy road conditions and struck the officer, causing multiple injuries from which he died at the scene.",m,0,1,0,0
113,And what a law-enforcement officer says he heard on a wire-tap or a ''bug'' is not necessarily what the speaker intended to convey in the conversation which was overheard.,m,0,1,0,0
114,"Despite this, they refused to arrest him and when Abby''s friend protested at their lack of action, one officer threatened to take him in instead.",u,0,0,1,0
115,"The Court has explicitly laid down that a director or officer might be liable with the company as joint tortfeasor for acts committed by the company ; · Whether a director or officer was so liable was determined not by the fact of his being a director or officer but by considering whether his acts would have rendered him so liable if he were not a director or officer. · For a director or officer of a company to be personally liable, as joint tortfeasor , for infringements of copyright by the company in circumstances in which he was not himself a person who had committed or participated directly in those acts, it was necessary and sufficient to find that; Ø that the director procured or induced the infringing acts to be done by the company; or Ø that , in some other way, he and the company had joined together in a concerted action to secure that those acts were done.",d,0,0,0,1
116,"Home > Improving Services > Special reports -- Parliamentary > SERPS: redress > Annex B Parliamentary Commissioner for Administration State earnings-related pension scheme (SERPS) inheritance provisions: redress for maladministration Annex B - Extracts from published DSS scheme of financial redress for maladministration (as revised September 1998) On misdirection: ""Documentary or incontrovertible proof of misdirection is not an essential requirement for the authorisation of a payment: the fact that documents may have been destroyed in the normal course of events, or that an officer cannot remember the case, would not in itself justify a refusal to make a special payment.",d,0,0,0,1
117,"On Arrival at or after Arrest at the Police Station As soon as is practicable after your arrival at the police station or answering to bail, or after arrest at the police station, the custody officer must determine whether there is sufficient evidence to charge you with the offence for which the arrest was made.",u,0,0,1,0
118,Q What excites you most about your new post as development officer for Donegal?,d,0,0,0,1
119,"""W e should not be expected to put up with any attack so being able to speak to an officer quickly is welcome.",u,0,0,1,0
120,"If it is determined that the act was performed whilst in the exercise of his/her functions and that the officer is under French jurisdiction, the custody officer must immediately inform the officer of his or her determination and arrange for the officer to be transferred to France within the permitted period (1993 Order Schedule 3 paragraph 5(8)).",u,0,0,1,0
121,"Constable Rodney Leake, who worked in the Traffic Department, was the last Essex Police officer to die on duty.",m,0,1,0,0
122,"The second half of the morning will be devoted to comparative waste strategies in which Andrew Witty, principal policy officer of the Scottish Environment Protection Agency (SEPA) will tell the conference audience about the national waste strategy for Scotland and the role EfW needs to play.",d,0,0,0,1
123,Eventually we launched and the Race officer had lots of problems.,d,0,0,0,1
124,His former positions include Herchel Smith Senior Research Fellow in Intellectual Property at CCLS and officer of the Australian Commonwealth Attorney-General''s Department.,d,0,0,0,1
125,"At 04:29 hrs, DO Mick Osborne, the officer leading Essex crews, reported ""steady progress being made"".",m,0,1,0,0
126,"As soon as reasonably practical after any disinterment, the officer of the burial authority will complete the statutory records to state: the date of disinterment the number of the grave the name of the person whose remains are disinterred where the remains have be re-interred or cremated Costs The cost of an exhumation can be substantial so the financial implications should be clearly established at the outset.",d,0,0,0,1
127,This is a Lister that Kochanski could really love - not just enjoy and then discard for a catering officer.,d,0,0,0,1
128,Chairman of the Ghana Trust and retired chief cocoa purchasing officer in the area.,d,0,0,0,1
129,"On the first of Aug. 1798 at the Battle of the Nile he served in the same ship and under the immediate eye and command of the great and gallant Nelson and from his conduct as an officer on the memorable occasion as well as in other times and days of trial, he gained the approbation and friendship and patronage of the immortal hero.",m,0,1,0,0
130,"You can see the progression officer at community organisations around Bethnal Green including Oxford House, Bethnal Green One Stop Shop and Boundary Community School.",d,0,0,0,1
131,"In the vast majority of cases, it is possible for an experienced hearing officer to come to a preliminary view on this question without such evidence, and this is what we propose to do.",d,0,0,0,1
132,In her letter to firm X officer D said that Mrs P should not receive any remuneration from either charity while CC were considering the question of remuneration.,d,0,0,0,1
133,"General Catroux , Grand Chancellor of the Legion and also the first officer senior to General de Gaulle to rally to his appeal from London in June, 1940, placed this round the new President''s neck in the great reception hall of the Elysée Palace at to-day''s ceremony.",m,0,1,0,0
134,Full length portrait of an unidentified officer.,u,0,0,1,0
135,For details of such courses contact the head teacher of your child''s school or the local road safety officer.,d,0,0,0,1
136,One is that Jaye Roycraft has experience as a female police officer as there is considerable technical detail concerning the police procedures.,f,1,0,0,0
137,"Date of Next Meeting Sunday 14 May, 7pm Action Points Gemma Ask the GU president for an electronic version of the GU proposals Organise the College Council elections by talking to JCSU and the Senior Treasurer about the returning officer.",d,0,0,0,1
138,"Tristan has kept his labour party membership out of any contentious decisions he has had to make, and I trust Kieran will do the same. posted Monday 13 February 2006 @ 10:29 by DG The low turn out typically has very little to do with the snr reps and comms officer and everything to do with the candidates.",d,0,0,0,1
139,"He went on to become a divisional commander, a position he held until his appointment in 1998 as a staff officer with Her Majesty''s Inspectorate of Constabulary.",m,0,1,0,0
140,"Recommendation 31: That the Executive Council should establish a structural profile and positions description of the whole Council, incorporating both officer positions and ordinary members, and outline the expertise required on Council for ICOM to be both well governed and able to take a leadership position on museums and cultural heritage issues, and to ensure that ICOM''s policies, programs, and strategic development proposals are implemented.",d,0,0,0,1
141,"Left to right: Shropshire''s Chief Fire officer Alan Taylor, Telford Leading Firefighter Drew Perkins, good neighbour Shyam Vadukul, father Girish and mother Ansuya with Fire Authority chairman Dave Morgan Everyone needs good neighbours and the Morris family from Telford certainly appreciate theirs.",d,0,0,0,1
142,(2) The officer incharge of any office or department shall afford all facilities and provide record for audit inspection and comply with requests for information in as complete a form as possible and with all reasonable expedition.,d,0,0,0,1
143,"The decision about whether a patient is well enough to proceed with the complaint should be made by a multi-disciplinary team, and the complaints officer should refer regularly to this team to establish when this point has been reached.",d,0,0,0,1
144,"I told him I had a wounded officer, wounded in the good cause, who was now able to make a change; and I proposed that his friends should take you for a lodger.",u,0,0,1,0
145,"The final presentation of the morning was a double act by two members of UKOLN: John Kirriemuir, the web editor of Ariadne (acting in his capacity as information officer for ROADS), and Brian Kelly (UK Web Focus Officer).",d,0,0,0,1
146,(2) The LSE or director will request clearance for the APU or GPU start from the air officer in PriFly through the flight deck officer.,u,0,0,1,0
147,"However, he relinquishes his position of chief operating officer to the non-board executive Jim Padilla who was previously executive vice president and president for The Americas.",d,0,0,0,1
148,"The sessions attended by your reporter included a step by step guide to the Instructors Award and Bronze Level Coaching Award, clarification of national vocational qualifications and a lesson from Alan Meegan, the national development officer, on how to tap into money from a variety of grant-awarding bodies.",d,0,0,0,1
149,For a time we had the senior officer stationed in the castle.,u,0,0,1,0
150,"Our transport officer, Ferraby, brother to the two at the Newlands links, has been wounded, not seriously, by a stray.",d,0,0,0,1
151,"Requests for information and documents outside of that legislation should be referred to the Force Solicitor. 14 POLICE OFFICERS AND SUPPORT STAFF REQUIRED TO GIVE EVIDENCE AT COURT FOR THE DEFENCE OR IN CIVIL PROCEEDINGS 14.1 A police officer or member of support staff who receives a Witness Summons or other notification requiring their attendance as a witness in Court should notify their Supervisor that such notice has been received. 14.2 If a specific court action is underway and a member of staff is likely to be called to give evidence then there is an exemption to the Data Protection Act under Section 35 which entitles them to give that evidence, notwithstanding that it is in breach of the data protection registration. 14.3 If the officer or member of staff has reason to believe that the",u,0,0,1,0
152,""" This letter purported to confirm that the appellant had had a TUPE transfer from Smartex to the respondent with effect from 12 December 2003 and that the transfer was to the position of finance and administrative officer, her normal place of work being the Accord Office; but the letter also said that her period of continuous service for statutory employment rights ran only from the date of the commencement of her employment with the respondent.",d,0,0,0,1
153,"However, such a situation might nevertheless provoke a breach of the peace (i.e. the owner might get physical) and if a police officer were to be present he might well be justified in arresting both the photographer and/or the house-owner/occupier for conduct likely to cause a breach of the peace - each to be taken before a magistrates court to be bound over to keep the peace.",m,0,1,0,0
154,If that time limit has passed but the return is under enquiry this matter should be brought to the attention of the officer conducting the enquiry.,u,0,0,1,0
155,"He has worked for the Civil Service and has served several Local Authorities, as an auditor, accountant and finance officer.",d,0,0,0,1
156,"The cottage is the post-war replacement for the building which originally stood there, and it was in that original building that Bruce Bairnsfather, a young officer serving in the 1st Battalion Royal Warwickshire Regiment, drew the first cartoons in a series which would make him famous as the creator of the immortal ""Old Bill"" character.",m,0,1,0,0
157,Trevor Wilkinson was a senior police officer for all that time also.,m,0,1,0,0
158,However we in Northern Ireland will no longer accept a second rate officer for this post.,u,0,0,1,0
159,"Perhaps a member or officer of that organisation, reading this article, would like to explain this obvious policy conflict for the benefit of our readers?",d,0,0,0,1
160,"police training; as evidenced by the HMIC Report, ""Winning the Race"" and the Police Training Council Report, and the clear evidence in Part 1 of this Inquiry which demonstrated that not a single officer questioned before us in 1998 had received any training of significance in racism awareness and race relations throughout the course of his or her career. 6.46 In reaching our conclusions we do not accept the contention of the Commissioner of the Metropolitan Police Service that, ""....... if this Inquiry labels my Service as institutionally racist the average police officer, the average member of the public will assume the normal meaning of those words.",u,0,0,1,0
161,"the first, he may even be the best, but donâ€TMt talk to Keith Floyd about â€ ̃celebrity chefsâ€TM. â€œI totally disapprove of celebrity chefs,â€? says the globetrotting master of the kitchen, who is bringing his theatre tour â€ ̃Floyd Uncorkedâ€TM to Newburyâ€TMs Corn Exchange on Wednesday, November 2. â€œAnd I totally disapprove of what they call â€ ̃gastro pubs,â€TM â€? adds the former journalist, army officer, dishwasher and barman who has made 19 TV series in which he has taken his culinary skills around the world, often taking local specialties into the homes and restaurants where they were first created. â€œI donâ€TMt invent dishes,â€? he says modestly, â€œI interpret them and hopefully add a little bit here and there.â€?",d,0,0,0,1
162,"(2) An officer of a credit union shall give security in accordance with paragraph (1) either-- (a) by becoming bound either with or without a surety as the board of directors may require, in a bond in such form as the board of directors may approve; or (b) by giving the security of a guarantee society; or (c) by giving such other security as the board of directors may direct.",d,0,0,0,1
163,""" 5 6 Uncertainty surrounding the future contribution of overseas doctors, who currently make up a sizeable proportion of the senior house officer workforce, also affects planning for service provision in hospitals and at what point they enter training grades.",d,0,0,0,1
164,The appeal judge found that the interpretation of bad faith had been correctly applied by the hearing officer.,d,0,0,0,1
165,"If the system would have been working correctly, a two-minute warning would have occurred before the door unlocked and the officer on duty would either give the go-ahead or discontinue the command.",u,0,0,1,0
166,"Tomb of an officer of Henry V . Near the pulpit is the tomb of an officer of Henry the Fifth''s army, a sharer, probably, in the glory of the battle of Agincourt.",u,0,0,1,0
167,"The Oxford project is based at the Oxford Uehiro Centre for Practical Ethics and the Principal Investigator is Professor Julian Savulescu, Uehiro Chair in Practical Ethics and Director of the Uehiro Centre . Dr Anders Sandberg is the lead research officer on the project, and Dr Bostrom is a named researcher.",d,0,0,0,1
168,"The Designated Deputy and/or an officer who heads the planning policy function and/or an officer who leads the development control function and/or an officer who heads the implementation function for the whole of the authority''s area and who report directly to a person named in (i) above; or iii) The officer who heads a Strategic Planning Unit, an Advisory or Support Team to a Regional Planning Body, a National Park or other organisation associated with planning in Local Government and of comparable standing to a person eligible for membership named in (i) or (ii) above; or",d,0,0,0,1
169,"Or the same as last year, when a light and variable breeze made it difficult for the race officer to lay a true starting line, giving an advantage to those boats that spotted the error?",d,0,0,0,1
170,The concept of the ''compliance officer'' in the U.,d,0,0,0,1
171,"Having refused to pay the $1 million ransom, the officer negotiated the asking price down to $250,000.",u,0,0,1,0
172,"""I suppose it is just possible that unorthodox punishment might have been meted out to him I will bear the story in mind when I speak to my Langi historian friend at Oxford"", writes the Uganda desk officer on Jan. 5.",u,0,0,1,0
173,"In this first action the Bays had lost one officer killed, two officers wounded and one captured, one troop sergeant major and three other ranks killed, and two wounded, with six missing.",u,0,0,1,0
174,"maintaining order or public security or of carrying into effect any regulation, order, rule, by-law, direction or notice made or issued under this Act, and no suit, prosecution or other legal proceeding shall lie in any court against any other person for or on account of or in respect of any act done or purporting to have been done by him under any regulation, order, rule, by-law, direction, notice or instruction of any public officer given for any such purpose as aforesaid: Provided that the act of such officer or person was done in good faith and in a reasonable belief that it was necessary for the purpose intended to be served thereby. 6.",u,0,0,1,0
175,"Charlotte Muskett, communications officer at Everyman, said: ""We started to think about ways of engaging young men, and we know that humour appeals to this kind of audience.",d,0,0,0,1
176,"The previous housing officer was in the process of arranging for tenants to be found alternative accommodation in the area, and by all accounts tenants were pleased with his work and the fact he was a local lad.",d,0,0,0,1
177,"For regulation 14 there shall be substituted the following regulation - "" 14 - (1) The appropriate authority or the appropriate officer, as the case may be, shall ensure that, as soon as practicable, the officer concerned is given written notice of the decision to refer the case to a hearing and supplied with copies of - (a) the certificate issued under regulation 11(6)(b)(i); (b) any statement he may have made to the investigating officer; and (c) any relevant statement, document or other material obtained during the course of the investigation.",d,0,0,0,1
178,"Sun: Open source is about self-interest Sun''s chief open source officer has told a conference to forget volunteerism and ideals, and think more like Warren Buffett Microsoft site to enable code sharing CodePlex will provide programmers with access to the source code of Microsoft''s products OpenLogic aims to keep open source honest Is the market for open source services beginning to take off?",d,0,0,0,1
179,"Each morning, PC Emma Shaw, a plain-clothes police officer based in Burnley, checks the computer to catch up on what''s happened the night before.",f,1,0,0,0
180,Contact your local police wildlife liaison officer through any police headquarters.,u,0,0,1,0
181,"Background Following a successful career as a social worker, manager, training officer and lecturer, Neil was appointed Professor of Applied Social Studies at Staffordshire University in December 1995.",d,0,0,0,1
182,"Jamie Nicol, Graduate Diploma in Counselling, Certificate in Counselling Jamie worked with adults with learning disabilities and challenging behaviour before employment as a residential officer for the probation service in bail and probation hostels throughout Staffordshire.",d,0,0,0,1
183,Targets for sickness levels are not currently being achieved and hours lost through police officer sickness has increased compared to the previous year.,u,0,0,1,0
184,"(Only while eating breakfast, honest!) So thanks to Scribbling Woman , I''ve found out via this quiz that my ideal historical job would be to be a Viking warrior . The other suggested alternatives included an ""arming squire with its potential to become a knight"", ""topman"" (sic), ""powder monkey"", ""Riding officer"", ""Petardier''s assistant"" or ""Guillemot-egg collector"".",u,0,0,1,0
185,A police officer is shot by one of the terrorists and Janet is shot in retaliation - she tells Ros to make a run for it.,u,0,0,1,0
186,""" Gerhard leaped to his feet as his superior officer walked into his office.",u,0,0,1,0
187,"I had no difficulty in finding the address that was a large country mansion, but the guard told me the officer was not there but at the site ""Down the road"".",u,0,0,1,0
188,During the war of 1866 he was employed as a general staff officer at Knin in Dalmatia and received a commendation from his commanding general Feldmarschall-Leutnant Philippovic.,m,0,1,0,0
189,Officer for years and wherever possible.,u,0,0,1,0
190,"Deborah Goodchild, equality, diversity and ethnicity officer said: ""We are delighted to be commended for the work we have carried out and welcome the national census.",d,0,0,0,1
191,"(That form was not related to Mrs K''s application, but the AP mistakenly thought that it was -- see entry for 6 February 1995.) 5/12/94 The CSAC wrote to the AP at address C saying that he was in arrears with his CSM payments. 7/12/94 Mrs K wrote to the Member complaining about the delay in resolving her CSM. 8/12/94 An enforcement officer at the CSAC spoke to Mrs K, who could not confirm whether the AP was employed or self-employed.",d,0,0,0,1
192,Operating officer of financing sources take mortgage taxes and free wyoming home owner insurance quote such exclusions are.,d,0,0,0,1
193,"I may have misunderstood exactly how much paperwork must be dug through before leaving daylight but the Union''s safety officer appears to require trip details (surveys, route descriptions) and details of who''s on the trip some time before setting off.",d,0,0,0,1
194,President OR Option B (exec): To amend the JHJCR constitution & election regulations to make the officer a member of the executive: a.,d,0,0,0,1
195,"The student will be entitled to attend the meeting and to be accompanied by a fellow student, a Students Union officer or a member of staff.",d,0,0,0,1
196,"Administration Admissions officer, examinations officer and deputy chair of the dept. ethics committee.",d,0,0,0,1
197,"As a serving officer in the armed forces, Lord Mounbatten progressed through the Order of the Bath.",m,0,1,0,0
198,"Contact the relevant lead officer in the School Improvement Division, Kingston Centre, Fairway, Stafford ST16 3TW ( tel: 01785 277900).",d,0,0,0,1
199,"Was it, as folk-lore tells, removed by an Army officer to build a summer house?",u,0,0,1,0
200,Monica Ward is a planning officer with South Lanarkshire Council.,d,0,0,0,1
201,"September (afternoon) , please contact the information officer or Jean Heap on 0161-427-0068 for further details.",d,0,0,0,1
202,"Under that section, relief was only available in respect of contributions paid by ""any officer or employee under a relevant statutory scheme"".",d,0,0,0,1
203,"He was replaced by a security officer, working for London Underground, who would not allow contractors on site without paying a minimum of £250.",d,0,0,0,1
204,"Familiarisation Courses: Bedfordshire Police hold a number of five-day ''Awareness'' Seminars and five-day ''Familiarisation'' Courses, designed to provide an insight into Bedfordshire Police, the work of a police officer and all elements of the recruitment and selection process, through practical exercises.",u,0,0,1,0
205,"In advance of this hearing, he''d been examined by the school medical officer and was certified as a mental defective.",d,0,0,0,1
206,"Failing officer training he is sent to a holding camp presided over by Terry-Thomas, with his perpetual cry of ""You''re a shower, an absolute shower"".",m,0,1,0,0
207,"While many took issue with the basic premise that an overriding 3D Web will be in place within 10 years, it was clear that most in attendance relished mixing it up as part of an august group that included Microsoft''s Robert Scoble, former Sony Online Entertainment chief creative officer Raph Koster, PARC researcher Bob Moore, online game pioneer Randy Farmer, There.com founder and currently IMVU chief executive Will Harvey, and CNET Networks editor at large Esther Dyson.",d,0,0,0,1
